REG NO: 223008033





mysql> CREATE DATABASE DBMSEXAM;
Query OK, 1 row affected (0.03 sec)

mysql> USE DBMSEXAM;
Database changed
mysql> CREATE TABLE CLIENT_MASTER (CLIENTNO INT PRIMARY KEY,NAME VARCHAR (100),ADDRESS VARCHAR (255),CITY VARCHAR(50), STATE VARCHAR (50), BAL_DUE DECIMAL (10,2) DEFAULT 0.00);
Query OK, 0 rows affected (0.07 sec)

QUESTION 1. mysql>  INSERT INTO client_master('123', 'John Doe', '123 Elm St', 'New York', 'NY', 4500);
mysql> INSERT INTO CLIENT_MASTER VALUES  ('124', 'Jaysquizer', 'LOS Angeles', 'CALIFORNIA', 'USA', 6000), ('125', 'RIRIMBA', 'KICUKIRO', 'KIGALI', 'RWANDA', 7500),('126', 'ARIANA GRANDE', 'LOSA', 'PINES', 'CHICAGO', 3000), ('127', 'JOMO KENYATA', 'MAKELELE', 'KAMPALA', 'UGANDA', 5200);
Query OK, 4 rows affected (0.00 sec)
Records: 4  Duplicates: 0  Warnings: 0

mysql> SELECT*FROM  CLIENT_MASTER;
+----------+---------------+-------------+------------+---------+---------+
| CLIENTNO | NAME          | ADDRESS     | CITY       | STATE   | BAL_DUE |
+----------+---------------+-------------+------------+---------+---------+
|        0 | John Doe      | 123 Elm St  | New York   | NY      | 4500.00 |
|      123 | JOHN MARY     | JALI        | GASABO     | RWANDA  | 4500.00 |
|      124 | Jaysquizer    | LOS Angeles | CALIFORNIA | USA     | 6000.00 |
|      125 | RIRIMBA       | KICUKIRO    | KIGALI     | RWANDA  | 7500.00 |
|      126 | ARIANA GRANDE | LOSA        | PINES      | CHICAGO | 3000.00 |
|      127 | JOMO KENYATA  | MAKELELE    | KAMPALA    | UGANDA  | 5200.00 |
+----------+---------------+-------------+------------+---------+---------+
6 rows in set (0.00 sec)

mysql>

QUESTION2. mysql> SELECT NAME FROM CLIENT_MASTER WHERE BAL_DUE>5000;
+--------------+
| NAME         |
+--------------+
| Jaysquizer   |
| RIRIMBA      |
| JOMO KENYATA |
+--------------+
3 rows in set (0.01 sec)

mysql>
QUESTION 3.mysql> UPDATE CLIENT_MASTER SET BAL_DUE = 5100 WHERE CLIENTNO = '123';
Query OK, 1 row affected (0.01 sec)
Rows matched: 1  Changed: 1  Warnings: 0

mysql> SELECT*FROM CLIENT_MASTER;
+----------+---------------+-------------+------------+---------+---------+
| CLIENTNO | NAME          | ADDRESS     | CITY       | STATE   | BAL_DUE |
+----------+---------------+-------------+------------+---------+---------+
|        0 | John Doe      | 123 Elm St  | New York   | NY      | 4500.00 |
|      123 | JOHN MARY     | JALI        | GASABO     | RWANDA  | 5100.00 |
|      124 | Jaysquizer    | LOS Angeles | CALIFORNIA | USA     | 6000.00 |
|      125 | RIRIMBA       | KICUKIRO    | KIGALI     | RWANDA  | 7500.00 |
|      126 | ARIANA GRANDE | LOSA        | PINES      | CHICAGO | 3000.00 |
|      127 | JOMO KENYATA  | MAKELELE    | KAMPALA    | UGANDA  | 5200.00 |
+----------+---------------+-------------+------------+---------+---------+
6 rows in set (0.00 sec)

mysql>

QUESTION 4.mysql> ALTER TABLE CLIENT_MASTER RENAME TO CLIENT12;
Query OK, 0 rows affected (0.03 sec)

mysql> SELECT*FROM CLIENT12;
+----------+---------------+-------------+------------+---------+---------+
| CLIENTNO | NAME          | ADDRESS     | CITY       | STATE   | BAL_DUE |
+----------+---------------+-------------+------------+---------+---------+
|        0 | John Doe      | 123 Elm St  | New York   | NY      | 4500.00 |
|      123 | JOHN MARY     | JALI        | GASABO     | RWANDA  | 5100.00 |
|      124 | Jaysquizer    | LOS Angeles | CALIFORNIA | USA     | 6000.00 |
|      125 | RIRIMBA       | KICUKIRO    | KIGALI     | RWANDA  | 7500.00 |
|      126 | ARIANA GRANDE | LOSA        | PINES      | CHICAGO | 3000.00 |
|      127 | JOMO KENYATA  | MAKELELE    | KAMPALA    | UGANDA  | 5200.00 |
+----------+---------------+-------------+------------+---------+---------+
6 rows in set (0.01 sec)

mysql>

PART B.

QUESTION6.

A) mysql> CREATE TABLE DEPARTMENTS (DEPARTMENT_ID INT PRIMARY KEY, DEPARTMENT_NAME VARCHAR (100));
Query OK, 0 rows affected (0.03 sec)

mysql> CREATE TABLE EMPLOYEES (EMPLOYEE_ID INT PRIMARY KEY, EMPLOYEE_NAME VARCHAR (100), DEPARTMENT_ID INT ,SALARY DECIMAL (10,2), FOREIGN KEY (DEPARTMENT_ID) REFERENCES DEPARTMENTS(DEPARTMENT_ID));
Query OK, 0 rows affected (0.03 sec)

mysql> INSERT INTO DEPARTMENTS VALUES (1, 'HR'), (2,'FINANCE'), (3,'ENGINEERING'), (4,'MARKETING'), (5,'SALES');
Query OK, 5 rows affected (0.01 sec)
Records: 5  Duplicates: 0  Warnings: 0

mysql> INSERT INTO EMPLOYEES VALUES (101,'ALICE',1,45000),(102,'LILIANE',2,55000), (103,'CHARLES',3,70000),(104,'DIANE',4,48000),(105,'EVE',5,60000);
Query OK, 5 rows affected (0.02 sec)
Records: 5  Duplicates: 0  Warnings: 0

mysql> SELECT*FROM DEPARTMENTS;
+---------------+-----------------+
| DEPARTMENT_ID | DEPARTMENT_NAME |
+---------------+-----------------+
|             1 | HR              |
|             2 | FINANCE         |
|             3 | ENGINEERING     |
|             4 | MARKETING       |
|             5 | SALES           |
+---------------+-----------------+
5 rows in set (0.00 sec)

mysql> SELECT*FROM EMPLOYEES;
+-------------+---------------+---------------+----------+
| EMPLOYEE_ID | EMPLOYEE_NAME | DEPARTMENT_ID | SALARY   |
+-------------+---------------+---------------+----------+
|         101 | ALICE         |             1 | 45000.00 |
|         102 | LILIANE       |             2 | 55000.00 |
|         103 | CHARLES       |             3 | 70000.00 |
|         104 | DIANE         |             4 | 48000.00 |
|         105 | EVE           |             5 | 60000.00 |
+-------------+---------------+---------------+----------+
5 rows in set (0.00 sec)

mysql>

B)mysql> DESCRIBE EMPLOYEES;
+---------------+---------------+------+-----+---------+-------+
| Field         | Type          | Null | Key | Default | Extra |
+---------------+---------------+------+-----+---------+-------+
| EMPLOYEE_ID   | int           | NO   | PRI | NULL    |       |
| EMPLOYEE_NAME | varchar(100)  | YES  |     | NULL    |       |
| DEPARTMENT_ID | int           | YES  | MUL | NULL    |       |
| SALARY        | decimal(10,2) | YES  |     | NULL    |       |
+---------------+---------------+------+-----+---------+-------+
4 rows in set (0.11 sec)

mysql>

C)mysql> SELECT EMPLOYEES.EMPLOYEE_NAME,DEPARTMENTS.DEPARTMENT_NAME FROM EMPLOYEES LEFT JOIN DEPARTMENTS ON EMPLOYEES.DEPARTMENT_ID=DEPARTMENTS.DEPARTMENT_ID;
+---------------+-----------------+
| EMPLOYEE_NAME | DEPARTMENT_NAME |
+---------------+-----------------+
| ALICE         | HR              |
| LILIANE       | FINANCE         |
| CHARLES       | ENGINEERING     |
| DIANE         | MARKETING       |
| EVE           | SALES           |
+---------------+-----------------+
5 rows in set (0.00 sec)

mysql>

D)mysql> SELECT EMPLOYEES.EMPLOYEE_NAME,DEPARTMENTS.DEPARTMENT_NAME FROM EMPLOYEES RIGHT JOIN DEPARTMENTS ON EMPLOYEES.DEPARTMENT_ID=DEPARTMENTS.DEPARTMENT_ID;
+---------------+-----------------+
| EMPLOYEE_NAME | DEPARTMENT_NAME |
+---------------+-----------------+
| ALICE         | HR              |
| LILIANE       | FINANCE         |
| CHARLES       | ENGINEERING     |
| DIANE         | MARKETING       |
| EVE           | SALES           |
+---------------+-----------------+
5 rows in set (0.02 sec)

E)mysql> SELECT EMPLOYEE_ID,EMPLOYEE_NAME,DEPARTMENT_ID,SALARY FROM EMPLOYEES WHERE SALARY > (SELECT AVG(SALARY) FROM EMPLOYEES);
+-------------+---------------+---------------+----------+
| EMPLOYEE_ID | EMPLOYEE_NAME | DEPARTMENT_ID | SALARY   |
+-------------+---------------+---------------+----------+
|         103 | CHARLES       |             3 | 70000.00 |
|         105 | EVE           |             5 | 60000.00 |
+-------------+---------------+---------------+----------+
2 rows in set (0.01 sec)

mysql>

QUESTION 7. 
7.1.    mysql> CREATE VIEW LIST_OF_STUDENTS AS SELECT * FROM STUDENTS;
Query OK, 0 rows affected (0.03 sec)

7.2    mysql> CREATE VIEW LIST_OF_GIRLS AS SELECT* FROM STUDENTS WHERE GENDER = 'FEMALE';
Query OK, 0 rows affected (0.02 sec)

7.3 mysql> CREATE VIEW LIST_OF_BOYS AS SELECT*FROM STUDENTS WHERE GENDER = 'MALE';
Query OK, 0 rows affected (0.00 sec)

7.4.  mysql> INSERT INTO STUDENTS VALUES ('5002', 'RUHAYA', 'MALE', 22, 'SOFTWARE ENGINEERING');
Query OK, 1 row affected (0.00 sec)

mysql>  INSERT INTO STUDENTS VALUES ('5001', 'SOLANGE UWIMPUHWE', 'FEMALE', 19, 'COMPUTER SCIENCE');
Query OK, 1 row affected (0.00 sec)

mysql>  INSERT INTO STUDENTS VALUES ('5003', 'TETA SANDRA', 'FEMALE', 21, 'BUSINESS FUNCTION');
Query OK, 1 row affected (0.00 sec)

mysql>  INSERT INTO STUDENTS VALUES ('5004', 'BERWA BOLINGO', 'MALE', 20, 'WATER ENGINEERING');
Query OK, 1 row affected (0.00 sec)

mysql>  INSERT INTO STUDENTS VALUES ('5005', 'ALNE DUDENGE', 'FEMALE', 18, 'COMPUTER ARCHTECTURE');
Query OK, 1 row affected (0.00 sec)

mysql>mysql> SELECT*FROM STUDENTS;
+-----------+-------------------+--------+------+----------------------+
| STUDENTID | FULLNAMES         | GENDER | AGE  | DEPARTMENT           |
+-----------+-------------------+--------+------+----------------------+
| 5002      | RUHAYA            | MALE   |   22 | SOFTWARE ENGINEERING |
| 5001      | SOLANGE UWIMPUHWE | FEMALE |   19 | COMPUTER SCIENCE     |
| 5003      | TETA SANDRA       | FEMALE |   21 | BUSINESS FUNCTION    |
| 5004      | BERWA BOLINGO     | MALE   |   20 | WATER ENGINEERING    |
| 5005      | ALNE DUDENGE      | FEMALE |   18 | COMPUTER ARCHTECTURE |
+-----------+-------------------+--------+------+----------------------+
5 rows in set (0.00 sec)

mysql>

7.5  mysql> DELETE FROM STUDENTS WHERE AGE<20;
Query OK, 2 rows affected (0.00 sec)

mysql> SELECT*FROM STUDENTS;
+-----------+---------------+--------+------+----------------------+
| STUDENTID | FULLNAMES     | GENDER | AGE  | DEPARTMENT           |
+-----------+---------------+--------+------+----------------------+
| 5002      | RUHAYA        | MALE   |   22 | SOFTWARE ENGINEERING |
| 5003      | TETA SANDRA   | FEMALE |   21 | BUSINESS FUNCTION    |
| 5004      | BERWA BOLINGO | MALE   |   20 | WATER ENGINEERING    |
+-----------+---------------+--------+------+----------------------+
3 rows in set (0.00 sec)

QUESTION 9

CREATE TABLE EMPLOYEES1 (EMPLOYEE_ID INT (100), FIRST_NAME VARCHAR (100), LAST_NAME VARCHAR(100), EMAIL VARCHAR(100), PHONE_NUMBER INT(120), HIRE_DATE DATE , JOB_ID INT(100), SALARY INT(120), COMMISSION_PCT DECIMAL(8,2), MANAGER_ID INT(50), DEPARTMENT_ID INT(40));
Query OK, 0 rows affected, 6 warnings (0.03 sec)
CREATE TABLE EMPLOYEES1 (EMPLOYEE_ID INT (100), FIRST_NAME VARCHAR (100), LAST_NAME VARCHAR(100), EMAIL VARCHAR(100), PHONE_NUMBER INT(120), HIRE_DATE DATE , JOB_ID INT(100), SALARY INT(120), COMMISSION_PCT DECIMAL(8,2), MANAGER_ID INT(50), DEPARTMENT_ID INT(40));
Query OK, 0 rows affected, 6 warnings (0.03 sec)

INSERT INTO EMPLOYEES1 VALUES (4, 'tuyubahe', 'onesm', 'onesm', '0796565', 01-' at line 1
mysql> select*from employees1;
+-------------+------------+-----------+--------+--------------+------------+--------+--------+----------------+------------+---------------+
| EMPLOYEE_ID | FIRST_NAME | LAST_NAME | EMAIL | PHONE_NUMBER | HIRE_DATE | JOB_ID | SALARY | COMMISSION_PCT | MANAGER_ID | DEPARTMENT_ID |
+-------------+------------+-----------+--------+--------------+------------+--------+--------+----------------+------------+---------------+
| 1 | RUKUNDO | JANVIER | rukund | 786565 | 0000-00-00 | 10 | 5000 | 3.00 | 100 | 50 |
| 2 | mamilla | irene | mamila | 7865656 | 0000-00-00 | 20 | 6000 | 3.00 | 200 | 60 |
| 3 | mutuyeyezu | oscar | oscar | 786667 | 0000-00-00 | 30 | 5500 | 4.00 | 300 | 70 |
| 4 | tuyubahe | onesm | onesm | 796565 | 0000-00-00 | 40 | 6790 | 5.00 | 400 | 80 |
+-------------+------------+-----------+--------+--------------+------------+--------+--------+----------------+------------+---------------+
4 rows in set (0.00 sec)

9.1 mysql> SELECT 
    employee_id, 
    CONCAT(first_name, ' ', last_name) AS full_name, salary from employees1;

9.2  mysql> SELECT 
    employee_id, 
    CONCAT(first_name, ' ', last_name) AS full_name, manager_id FROM    employees1 WHERE manager_id = 100;

question 10. 
a)mysql> insert into sales values (2 , 'jane smith', 'branch b', 3000, '2009-12-22' );
Query OK, 1 row affected (0.00 sec)

mysql> insert into sales values (3 , 'jim brown', 'branch c', 25000, '2009-10-22' );
Query OK, 1 row affected (0.00 sec)

mysql> insert into sales values (4,'jake white', 'branch d', 3500, '2009-11-22' );)
Query OK, 1 row affected (0.00 sec)
mysql> insert into sales values (5 , 'jill green', 'branch e', 1800, '2009-11-22' );
Query OK, 1 row affected (0.00 sec)
mysql> select * from sales;
+----------+------------+----------+-------------+------------+
| sales_no | salesname | branch | salesamount | dob |
+----------+------------+----------+-------------+------------+
| 1 | john doe | branch a | 1500.00 | 2009-12-21 |
| 2 | jane smith | branch b | 3000.00 | 2009-12-22 |
| 3 | jim brown | branch c | 25000.00 | 2009-10-22 |
| 4 | jake white | branch d | 3500.00 | 2009-11-22 |
| 5 | jill green | branch e | 1800.00 | 2009-11-22 |
+----------+------------+----------+-------------+------------+
5 rows in set (0.00 sec)


c) mysql> select branch , avg(salesamount) as averagesales from sales group by branch;
+----------+--------------+
| branch | averagesales |
+----------+--------------+
| branch a | 1500.000000 |
| branch b | 3000.000000 |
| branch c | 25000.000000 |
| branch d | 3500.000000 |
| branch e | 1800.000000 |
+----------+--------------+
5 rows in set (0.03 sec)

d)
    mysql> select salesname , dob from sales where month(dob) = 12;
+------------+------------+
| salesname | dob |
+------------+------------+
| john doe | 2009-12-21 |
| jane smith | 2009-12-22 |
+------------+------------+
2 rows in set (0.01 sec)

e)mysql> select salesname dob from sales order by salesname asc;
+------------+
| dob |
+------------+
| jake white |
| jane smith |
| jill green |
| jim brown |
| john doe |
+------------+
5 rows in set (0.02 sec)

mysql>



    
 



